{
  "work_id": "wi-1001",
  "attempt_id": "2",
  "generation": 1,
  "host": "host-04",
  "repository": "billing-service",
  "base_revision": "a1b2c3d4e5f6",
  "head_revision": "f9e8d7c6b5a4",
  "workspace": "/var/factory/workspaces/wi-1001",
  "target_evidence": [
    {
      "type": "symbol_definition",
      "symbol": "InvoiceAdapter.Emit",
      "source_revision": "a1b2c3d4e5f6"
    }
  ],
  "affected_files": [
    "billing/invoice_adapter.go",
    "billing/invoice_adapter_test.go"
  ],
  "affected_symbols": [
    "InvoiceAdapter.Emit"
  ],
  "artifact_digest": "sha256:9f2c41d8a07b55c3e6d1f0aa8b2c9d4e7f6a5b4c3d2e1f0a9b8c7d6e5f4a3b2c",
  "verification_id": "ver-5501",
  "publication_state": "published"
}
